{
  "function_id": "FUNC.ROUND",
  "surface_name": "ROUND",
  "published_row_id": "FUNC.ROUND",
  "entry_kind": "built_in_function",
  "category": "Math and trigonometry functions",
  "admission": {
    "label": "supported",
    "reason": null
  },
  "metadata_status": "function_meta_extracted",
  "xlcall": {
    "symbol": "xlfRound",
    "code": "27"
  },
  "arity": {
    "min": 2,
    "max": 2
  },
  "classification": {
    "arg_preparation_profile": "ValuesOnlyPreAdapter",
    "coercion_lift_profile": "UnaryNumericScalarOnly",
    "determinism_class": "Deterministic",
    "error_collapse_profile": "None",
    "fec_dependency_profile": "None",
    "host_interaction_class": "None",
    "kernel_signature_class": "NumsToNum",
    "rich_value_usage": "RichBlind",
    "surface_fec_dependency_profile": "RefOnly",
    "thread_safety_class": "SafePure",
    "volatility_class": "NonVolatile"
  },
  "axes": {
    "lift_broadcast_profile": "surface_native",
    "precision_rounding_profile": "default",
    "real_result_policy": "real_result_policy.v1;arg_domain_guard=none;non_finite=allow",
    "axes_version": "function_spec_axes_metadata.v1;lift_broadcast_profile=surface_native;precision_rounding_profile=default;real_result_policy=real_result_policy.v1;arg_domain_guard=none;non_finite=allow",
    "semantic_kernel_version": "semantic_kernel_metadata.v1;reduction_sensitive=false;error_collapse_sensitive=false;numerical_reduction_policy=none;error_algebra=none",
    "arg_admission_version": "arg_admission_metadata.v1;existing_arg_preparation=values_only_pre_adapter"
  },
  "axis_provenance": {
    "arg_admission_version": {
      "provenance_class": "implementation-fact",
      "oxfunc_tier": "A"
    },
    "arg_preparation_profile": {
      "provenance_class": "default-unexamined",
      "oxfunc_tier": "B"
    },
    "axes_version": {
      "provenance_class": "implementation-fact",
      "oxfunc_tier": "A"
    },
    "coercion_lift_profile": {
      "provenance_class": "implementation-fact",
      "oxfunc_tier": "B"
    },
    "determinism_class": {
      "provenance_class": "implementation-fact",
      "oxfunc_tier": "B"
    },
    "error_collapse_profile": {
      "provenance_class": "default-unexamined",
      "oxfunc_tier": "C"
    },
    "fec_dependency_profile": {
      "provenance_class": "implementation-fact",
      "oxfunc_tier": "B"
    },
    "host_interaction_class": {
      "provenance_class": "implementation-fact",
      "oxfunc_tier": "B"
    },
    "kernel_signature_class": {
      "provenance_class": "implementation-fact",
      "oxfunc_tier": "B"
    },
    "lift_broadcast_profile": {
      "provenance_class": "default-unexamined",
      "oxfunc_tier": "A"
    },
    "precision_rounding_profile": {
      "provenance_class": "default-unexamined",
      "oxfunc_tier": "A"
    },
    "real_result_policy": {
      "provenance_class": "default-unexamined",
      "oxfunc_tier": "A"
    },
    "rich_value_usage": {
      "provenance_class": "implementation-fact",
      "oxfunc_tier": "A"
    },
    "semantic_kernel_version": {
      "provenance_class": "implementation-fact",
      "oxfunc_tier": "A"
    },
    "surface_fec_dependency_profile": {
      "provenance_class": "implementation-fact",
      "oxfunc_tier": "B"
    },
    "thread_safety_class": {
      "provenance_class": "implementation-fact",
      "oxfunc_tier": "B"
    },
    "volatility_class": {
      "provenance_class": "implementation-fact",
      "oxfunc_tier": "B"
    }
  },
  "signature": {
    "display": "ROUND(number, num_digits)",
    "trailing_repeats": false,
    "parameters": [
      {
        "name": "number",
        "optional": false,
        "repeats": false,
        "description": null
      },
      {
        "name": "num_digits",
        "optional": false,
        "repeats": false,
        "description": null
      }
    ]
  },
  "signature_placeholder": false,
  "descriptions": {
    "short": "Number rounded to a number of digits",
    "short_source": "dna-calc-own",
    "long": null
  },
  "docs": {
    "microsoft_url": "https://support.microsoft.com/en-us/office/round-function-c018c5d8-40fb-4053-90b1-b3e7f61a213c",
    "english_description": null
  },
  "localized_names": [
    {
      "locale": "ar-SA",
      "name": "ROUND"
    },
    {
      "locale": "bg-BG",
      "name": "ROUND"
    },
    {
      "locale": "cs-CZ",
      "name": "ZAOKROUHLIT"
    },
    {
      "locale": "da-DK",
      "name": "AFRUND"
    },
    {
      "locale": "de-DE",
      "name": "ROUND"
    },
    {
      "locale": "el-GR",
      "name": "ROUND"
    },
    {
      "locale": "en-AU",
      "name": "ROUND"
    },
    {
      "locale": "en-GB",
      "name": "ROUND"
    },
    {
      "locale": "en-US",
      "name": "ROUND"
    },
    {
      "locale": "es-ES",
      "name": "REDONDEAR"
    },
    {
      "locale": "et-EE",
      "name": "ROUND"
    },
    {
      "locale": "fi-FI",
      "name": "KIERROS"
    },
    {
      "locale": "fr-FR",
      "name": "ARRONDI*"
    },
    {
      "locale": "he-IL",
      "name": "ROUND"
    },
    {
      "locale": "hr-HR",
      "name": "ROUND"
    },
    {
      "locale": "hu-HU",
      "name": "KEREKÍTÉS"
    },
    {
      "locale": "id-ID",
      "name": "ROUND"
    },
    {
      "locale": "it-IT",
      "name": "ROUND"
    },
    {
      "locale": "ja-JP",
      "name": "ROUND"
    },
    {
      "locale": "ko-KR",
      "name": "ROUND"
    },
    {
      "locale": "lt-LT",
      "name": "ROUND"
    },
    {
      "locale": "lv-LV",
      "name": "ROUND"
    },
    {
      "locale": "nb-NO",
      "name": "AVRUND"
    },
    {
      "locale": "nl-NL",
      "name": "RONDE"
    },
    {
      "locale": "pl-PL",
      "name": "ZAOKR"
    },
    {
      "locale": "pt-BR",
      "name": "ROUND"
    },
    {
      "locale": "pt-PT",
      "name": "ARRED"
    },
    {
      "locale": "ro-RO",
      "name": "ROUND"
    },
    {
      "locale": "ru-RU",
      "name": "ОКРУГЛ"
    },
    {
      "locale": "sk-SK",
      "name": "KOLO"
    },
    {
      "locale": "sl-SI",
      "name": "ROUND"
    },
    {
      "locale": "sr-Latn-RS",
      "name": "ROUND"
    },
    {
      "locale": "sv-SE",
      "name": "AVRUNDA"
    },
    {
      "locale": "th-TH",
      "name": "ROUND"
    },
    {
      "locale": "tr-TR",
      "name": "YUVARLA"
    },
    {
      "locale": "uk-UA",
      "name": "ROUND"
    },
    {
      "locale": "vi-VN",
      "name": "ROUND"
    },
    {
      "locale": "zh-CN",
      "name": "ROUND"
    },
    {
      "locale": "zh-HK",
      "name": "ROUND"
    },
    {
      "locale": "zh-TW",
      "name": "ROUND"
    }
  ],
  "localization": {
    "raw_organ": "data/localization/function-name-index.json",
    "function_article_guid": "c018c5d8-40fb-4053-90b1-b3e7f61a213c",
    "scope": "function",
    "status": "article_unique",
    "article_row_count": 40,
    "resolved_name_count": 40
  },
  "artifacts": {
    "contract_row_id": "FN-ROUND-001",
    "lean_module": "OxFunc.Functions.Round",
    "rust_module": "oxfunc_core::functions::round_fn",
    "status": "provisional"
  },
  "version_marker": null,
  "special_interface_kind": "ordinary",
  "admission_interface_kind": "ordinary_call",
  "registry_backed": true,
  "oxfunc_tree_clean": true,
  "vintage": {
    "admission": "lane-csv:W50_DEFERRED_CURRENT_VERSION_INVENTORY.csv@473efa3:clean:undated",
    "arity": "live-registry:473efa3:clean:undated",
    "artifacts": "lane-csv:FUNCTION_SLICE_CORRELATION_LEDGER.csv@473efa3:clean:undated",
    "axes": "live-registry:473efa3:clean:undated",
    "axis_provenance": "live-registry:473efa3:clean:undated",
    "category": "export-snapshot:oxfunc-libctx-v1@87ef585:dirty:2026-04-02",
    "classification": "live-registry:473efa3:clean:undated",
    "descriptions": "live-registry:473efa3:clean:undated",
    "docs": "lane-csv:FUNCTION_CATALOG_CURRENT_BASELINE_LOCAL.csv@473efa3:clean:undated",
    "identity": "export-snapshot:oxfunc-libctx-v1@87ef585:dirty:2026-04-02",
    "interface_markers": "export-snapshot:oxfunc-libctx-v1@87ef585:dirty:2026-04-02",
    "localization": "lane-csv:W28_FUNCTION_NAME_LOCALIZATION_LIBRARY_SEED.csv@473efa3:clean:undated",
    "localized_names": "lane-csv:W28_FUNCTION_NAME_LOCALIZATION_LIBRARY_SEED.csv@473efa3:clean:undated",
    "metadata_status": "export-snapshot:oxfunc-libctx-v1@87ef585:dirty:2026-04-02",
    "oxfunc_tree_clean": "live-registry:473efa3:clean:undated",
    "registry_backed": "live-registry:473efa3:clean:undated",
    "signature": "live-registry:473efa3:clean:undated",
    "signature_placeholder": "live-registry:473efa3:clean:undated",
    "xlcall": "export-snapshot:oxfunc-libctx-v1@87ef585:dirty:2026-04-02"
  }
}
