{
  "function_id": "FUNC.DB",
  "surface_name": "DB",
  "published_row_id": "FUNC.DB",
  "entry_kind": "built_in_function",
  "category": "Financial functions",
  "admission": {
    "label": "supported",
    "reason": null
  },
  "metadata_status": "function_meta_curated",
  "xlcall": {
    "symbol": "xlfDb",
    "code": "247"
  },
  "arity": {
    "min": 4,
    "max": 5
  },
  "classification": {
    "arg_preparation_profile": "ValuesOnlyPreAdapter",
    "coercion_lift_profile": "Custom",
    "determinism_class": "Deterministic",
    "error_collapse_profile": "None",
    "fec_dependency_profile": "None",
    "host_interaction_class": "None",
    "kernel_signature_class": "Custom",
    "rich_value_usage": "RichBlind",
    "surface_fec_dependency_profile": "RefOnly",
    "thread_safety_class": "SafePure",
    "volatility_class": "NonVolatile"
  },
  "axes": {
    "lift_broadcast_profile": "surface_native",
    "precision_rounding_profile": "default",
    "real_result_policy": "real_result_policy.v1;arg_domain_guard=none;non_finite=allow",
    "axes_version": "function_spec_axes_metadata.v1;lift_broadcast_profile=surface_native;precision_rounding_profile=default;real_result_policy=real_result_policy.v1;arg_domain_guard=none;non_finite=allow",
    "semantic_kernel_version": "semantic_kernel_metadata.v1;reduction_sensitive=false;error_collapse_sensitive=false;numerical_reduction_policy=none;error_algebra=none",
    "arg_admission_version": "arg_admission_metadata.v1;existing_arg_preparation=values_only_pre_adapter"
  },
  "axis_provenance": {
    "arg_admission_version": {
      "provenance_class": "implementation-fact",
      "oxfunc_tier": "A"
    },
    "arg_preparation_profile": {
      "provenance_class": "default-unexamined",
      "oxfunc_tier": "B"
    },
    "axes_version": {
      "provenance_class": "implementation-fact",
      "oxfunc_tier": "A"
    },
    "coercion_lift_profile": {
      "provenance_class": "implementation-fact",
      "oxfunc_tier": "B"
    },
    "determinism_class": {
      "provenance_class": "implementation-fact",
      "oxfunc_tier": "B"
    },
    "error_collapse_profile": {
      "provenance_class": "default-unexamined",
      "oxfunc_tier": "C"
    },
    "fec_dependency_profile": {
      "provenance_class": "implementation-fact",
      "oxfunc_tier": "B"
    },
    "host_interaction_class": {
      "provenance_class": "implementation-fact",
      "oxfunc_tier": "B"
    },
    "kernel_signature_class": {
      "provenance_class": "implementation-fact",
      "oxfunc_tier": "B"
    },
    "lift_broadcast_profile": {
      "provenance_class": "default-unexamined",
      "oxfunc_tier": "A"
    },
    "precision_rounding_profile": {
      "provenance_class": "default-unexamined",
      "oxfunc_tier": "A"
    },
    "real_result_policy": {
      "provenance_class": "default-unexamined",
      "oxfunc_tier": "A"
    },
    "rich_value_usage": {
      "provenance_class": "implementation-fact",
      "oxfunc_tier": "A"
    },
    "semantic_kernel_version": {
      "provenance_class": "implementation-fact",
      "oxfunc_tier": "A"
    },
    "surface_fec_dependency_profile": {
      "provenance_class": "implementation-fact",
      "oxfunc_tier": "B"
    },
    "thread_safety_class": {
      "provenance_class": "implementation-fact",
      "oxfunc_tier": "B"
    },
    "volatility_class": {
      "provenance_class": "implementation-fact",
      "oxfunc_tier": "B"
    }
  },
  "signature": null,
  "signature_placeholder": true,
  "descriptions": {
    "short": "Returns the depreciation of an asset for a specified period by using the fixed-declining balance method",
    "short_source": "microsoft-english-verbatim",
    "long": null
  },
  "docs": {
    "microsoft_url": "https://support.microsoft.com/en-us/office/db-function-354e7d28-5f93-4ff1-8a52-eb4ee549d9d7",
    "english_description": "Returns the depreciation of an asset for a specified period by using the fixed-declining balance method"
  },
  "localized_names": [
    {
      "locale": "ar-SA",
      "name": "قاعدة بيانات"
    },
    {
      "locale": "bg-BG",
      "name": "DB"
    },
    {
      "locale": "cs-CZ",
      "name": "DB"
    },
    {
      "locale": "da-DK",
      "name": "DB"
    },
    {
      "locale": "de-DE",
      "name": "DB"
    },
    {
      "locale": "el-GR",
      "name": "DB"
    },
    {
      "locale": "en-AU",
      "name": "DB"
    },
    {
      "locale": "en-GB",
      "name": "DB"
    },
    {
      "locale": "en-US",
      "name": "DB"
    },
    {
      "locale": "es-ES",
      "name": "NOSQL"
    },
    {
      "locale": "et-EE",
      "name": "DB"
    },
    {
      "locale": "fi-FI",
      "name": "DB"
    },
    {
      "locale": "fr-FR",
      "name": "Base de données"
    },
    {
      "locale": "he-IL",
      "name": "DB"
    },
    {
      "locale": "hr-HR",
      "name": "DB"
    },
    {
      "locale": "hu-HU",
      "name": "KCS2"
    },
    {
      "locale": "id-ID",
      "name": "DB"
    },
    {
      "locale": "it-IT",
      "name": "DB"
    },
    {
      "locale": "ja-JP",
      "name": "DB"
    },
    {
      "locale": "ko-KR",
      "name": "DB"
    },
    {
      "locale": "lt-LT",
      "name": "DB"
    },
    {
      "locale": "lv-LV",
      "name": "DB"
    },
    {
      "locale": "nb-NO",
      "name": "DB"
    },
    {
      "locale": "nl-NL",
      "name": "DB"
    },
    {
      "locale": "pl-PL",
      "name": "DB"
    },
    {
      "locale": "pt-BR",
      "name": "NoSQL"
    },
    {
      "locale": "pt-PT",
      "name": "DB"
    },
    {
      "locale": "ro-RO",
      "name": "DB"
    },
    {
      "locale": "ru-RU",
      "name": "ФУО"
    },
    {
      "locale": "sk-SK",
      "name": "DB"
    },
    {
      "locale": "sl-SI",
      "name": "DB"
    },
    {
      "locale": "sr-Latn-RS",
      "name": "DB"
    },
    {
      "locale": "sv-SE",
      "name": "DB"
    },
    {
      "locale": "th-TH",
      "name": "DB"
    },
    {
      "locale": "tr-TR",
      "name": "DB"
    },
    {
      "locale": "uk-UA",
      "name": "DB"
    },
    {
      "locale": "vi-VN",
      "name": "DB"
    },
    {
      "locale": "zh-CN",
      "name": "DB"
    },
    {
      "locale": "zh-HK",
      "name": "DB"
    },
    {
      "locale": "zh-TW",
      "name": "DB"
    }
  ],
  "localization": {
    "raw_organ": "data/localization/microsoft-support-function-index.json",
    "function_article_guid": "354e7d28-5f93-4ff1-8a52-eb4ee549d9d7",
    "scope": "function",
    "status": "article_unique",
    "article_row_count": 40,
    "resolved_name_count": 40
  },
  "artifacts": null,
  "version_marker": null,
  "special_interface_kind": "ordinary",
  "admission_interface_kind": "ordinary_call",
  "registry_backed": true,
  "oxfunc_tree_clean": true,
  "vintage": {
    "admission": "lane-csv:W50_DEFERRED_CURRENT_VERSION_INVENTORY.csv@473efa3:clean:undated",
    "arity": "live-registry:473efa3:clean:undated",
    "artifacts": "lane-csv:FUNCTION_SLICE_CORRELATION_LEDGER.csv@473efa3:clean:undated",
    "axes": "live-registry:473efa3:clean:undated",
    "axis_provenance": "live-registry:473efa3:clean:undated",
    "category": "export-snapshot:oxfunc-libctx-v1@87ef585:dirty:2026-04-02",
    "classification": "live-registry:473efa3:clean:undated",
    "descriptions": "live-registry:473efa3:clean:undated",
    "docs": "lane-csv:FUNCTION_CATALOG_CURRENT_BASELINE_LOCAL.csv@473efa3:clean:undated",
    "identity": "export-snapshot:oxfunc-libctx-v1@87ef585:dirty:2026-04-02",
    "interface_markers": "export-snapshot:oxfunc-libctx-v1@87ef585:dirty:2026-04-02",
    "localization": "lane-csv:W28_FUNCTION_NAME_LOCALIZATION_LIBRARY_SEED.csv@473efa3:clean:undated",
    "localized_names": "lane-csv:W28_FUNCTION_NAME_LOCALIZATION_LIBRARY_SEED.csv@473efa3:clean:undated",
    "metadata_status": "export-snapshot:oxfunc-libctx-v1@87ef585:dirty:2026-04-02",
    "oxfunc_tree_clean": "live-registry:473efa3:clean:undated",
    "registry_backed": "live-registry:473efa3:clean:undated",
    "signature": "live-registry:473efa3:clean:undated",
    "signature_placeholder": "live-registry:473efa3:clean:undated",
    "xlcall": "export-snapshot:oxfunc-libctx-v1@87ef585:dirty:2026-04-02"
  }
}
